student_id,student_name,age,email,country,language_level,attendance_rate,homework_completion,test1_score,test2_score,test3_score,teacher_feedback,age_range,final_grade,classification
707,Pauletta Adney,34,padneyjm@marketwatch.com,South Africa,intermediate,89.55,1,7.56,4.05,3.51,"Integer tincidunt ante vel ipsum. Praesent blandit lacinia erat. Vestibulum sed magna at nunc commodo placerat. Praesent blandit. Nam nulla. Integer pede justo, lacinia eget, tincidunt eget, tempus vel, pede. Morbi porttitor lorem id ligula. Suspendisse ornare consequat lectus. In est risus, auctor sed, tristique in, tempus sit amet, sem.",31-40,5.04,D
708,Yasmeen Haistwell,42,yhaistwelljn@livejournal.com,Russia,beginner,54.84,0,4.52,7.17,3.45,Suspendisse accumsan tortor quis turpis.,41-50,5.046666666666667,D
709,Delores Sleith,36,dsleithjo@meetup.com,Sweden,beginner,95.07,1,9.27,1.94,5.18,"Vestibulum quam sapien, varius ut, blandit non, interdum in, ante. Vestibulum ante ipsum primis in faucibus orci luctus et ultrices posuere cubilia Curae; Duis faucibus accumsan odio. Curabitur convallis. Duis consequat dui nec nisi volutpat eleifend. Donec ut dolor.",31-40,5.463333333333334,D
710,Laurent Lyndon,62,llyndonjp@aol.com,China,intermediate,56.47,0,7.17,1.28,6.48,"Etiam vel augue. Vestibulum rutrum rutrum neque. Aenean auctor gravida sem. Praesent id massa id nisl venenatis lacinia. Aenean sit amet justo. Morbi ut odio. Cras mi pede, malesuada in, imperdiet et, commodo vulputate, justo.",61-70,4.976666666666667,D
711,Peter Basley,52,pbasleyjq@utexas.edu,Argentina,intermediate,75.98,0,3.38,2.43,4.88,Ut at dolor quis odio consequat varius. Integer ac leo.,51-60,3.563333333333334,E
712,Arnuad Brakespear,42,abrakespearjr@baidu.com,Indonesia,advanced,84.26,0,2.56,8.68,7.31,"Nam dui. Proin leo odio, porttitor id, consequat in, consequat ut, nulla. Sed accumsan felis. Ut at dolor quis odio consequat varius. Integer ac leo. Pellentesque ultrices mattis odio. Donec vitae nisi. Nam ultrices, libero non mattis pulvinar, nulla pede ullamcorper augue, a suscipit nulla elit ac nulla. Sed vel enim sit amet nunc viverra dapibus. Nulla suscipit ligula in lacus.",41-50,6.183333333333334,C
713,Gussie Hallatt,23,ghallattjs@alibaba.com,Croatia,beginner,44.89,1,8.79,3.49,2.52,"Cras pellentesque volutpat dui. Maecenas tristique, est et tempus semper, est quam pharetra magna, ac consequat metus sapien ut nunc. Vestibulum ante ipsum primis in faucibus orci luctus et ultrices posuere cubilia Curae; Mauris viverra diam vitae quam. Suspendisse potenti. Nullam porttitor lacus at turpis. Donec posuere metus vitae ipsum. Aliquam non mauris. Morbi non lectus.",21-30,4.933333333333333,D
714,Worthy Davies,60,wdaviesjt@unblog.fr,Eritrea,intermediate,90.18,1,5.87,7.38,1.2,"Cum sociis natoque penatibus et magnis dis parturient montes, nascetur ridiculus mus. Vivamus vestibulum sagittis sapien. Cum sociis natoque penatibus et magnis dis parturient montes, nascetur ridiculus mus. Etiam vel augue. Vestibulum rutrum rutrum neque.",51-60,4.816666666666666,D
715,Orelee Moses,58,omosesju@wufoo.com,Portugal,intermediate,78.27,1,5.91,6.7,3.38,"Suspendisse potenti. Cras in purus eu magna vulputate luctus. Cum sociis natoque penatibus et magnis dis parturient montes, nascetur ridiculus mus. Vivamus vestibulum sagittis sapien. Cum sociis natoque penatibus et magnis dis parturient montes, nascetur ridiculus mus. Etiam vel augue. Vestibulum rutrum rutrum neque. Aenean auctor gravida sem. Praesent id massa id nisl venenatis lacinia. Aenean sit amet justo.",51-60,5.329999999999999,D
716,Launce Greguol,48,lgreguoljv@wordpress.org,Portugal,beginner,85.04,0,0.02,5.31,3.67,"Maecenas tristique, est et tempus semper, est quam pharetra magna, ac consequat metus sapien ut nunc. Vestibulum ante ipsum primis in faucibus orci luctus et ultrices posuere cubilia Curae; Mauris viverra diam vitae quam. Suspendisse potenti.",41-50,3.0,E
717,De Southwick,42,dsouthwickjw@geocities.jp,Philippines,intermediate,78.35,1,3.09,8.81,2.53,"Morbi non lectus. Aliquam sit amet diam in magna bibendum imperdiet. Nullam orci pede, venenatis non, sodales sed, tincidunt eu, felis.",41-50,4.81,D
718,Milt MacGilfoyle,41,mmacgilfoylejx@salon.com,China,beginner,87.51,0,6.22,7.51,7.56,"Donec odio justo, sollicitudin ut, suscipit a, feugiat et, eros. Vestibulum ac est lacinia nisi venenatis tristique. Fusce congue, diam id ornare imperdiet, sapien urna pretium nisl, ut volutpat sapien arcu sed augue. Aliquam erat volutpat. In congue. Etiam justo. Etiam pretium iaculis justo. In hac habitasse platea dictumst. Etiam faucibus cursus urna. Ut tellus.",41-50,7.096666666666667,C
719,Debera Davidou,29,ddavidoujy@hao123.com,Sri Lanka,advanced,98.74,0,2.37,8.16,7.58,"Vestibulum ante ipsum primis in faucibus orci luctus et ultrices posuere cubilia Curae; Donec pharetra, magna vestibulum aliquet ultrices, erat tortor sollicitudin mi, sit amet lobortis sapien sapien non mi. Integer ac neque. Duis bibendum. Morbi non quam nec dui luctus rutrum. Nulla tellus. In sagittis dui vel nisl. Duis ac nibh.",21-30,6.036666666666666,C
720,Augustine Camamill,58,acamamilljz@loc.gov,China,beginner,42.89,1,9.68,7.32,9.93,"In est risus, auctor sed, tristique in, tempus sit amet, sem. Fusce consequat. Nulla nisl. Nunc nisl. Duis bibendum, felis sed interdum venenatis, turpis enim blandit mi, in porttitor pede justo eu massa. Donec dapibus. Duis at velit eu est congue elementum. In hac habitasse platea dictumst. Morbi vestibulum, velit id pretium iaculis, diam erat fermentum justo, nec condimentum neque sapien placerat ante. Nulla justo.",51-60,8.976666666666667,B
721,Sibby Klampk,64,sklampkk0@1688.com,Palau,advanced,30.14,1,9.95,4.78,8.5,"Lorem ipsum dolor sit amet, consectetuer adipiscing elit.",61-70,7.743333333333333,C
722,Tobey Forsythe,52,tforsythek1@sakura.ne.jp,Philippines,beginner,4.78,0,7.41,9.37,9.62,"Morbi vel lectus in quam fringilla rhoncus. Mauris enim leo, rhoncus sed, vestibulum sit amet, cursus id, turpis. Integer aliquet, massa id lobortis convallis, tortor risus dapibus augue, vel accumsan tellus nisi eu orci. Mauris lacinia sapien quis libero. Nullam sit amet turpis elementum ligula vehicula consequat. Morbi a ipsum. Integer a nibh. In quis justo.",51-60,8.799999999999999,B
723,Talbert Swires,34,tswiresk2@eventbrite.com,Syria,advanced,54.12,0,9.36,7.52,0.01,"Maecenas tincidunt lacus at velit. Vivamus vel nulla eget eros elementum pellentesque. Quisque porta volutpat erat. Quisque erat eros, viverra eget, congue eget, semper rutrum, nulla. Nunc purus. Phasellus in felis. Donec semper sapien a libero. Nam dui. Proin leo odio, porttitor id, consequat in, consequat ut, nulla. Sed accumsan felis.",31-40,5.63,D
724,Ede Bruno,21,ebrunok3@state.tx.us,Belarus,beginner,75.31,1,7.25,1.74,4.2,"Maecenas leo odio, condimentum id, luctus nec, molestie sed, justo. Pellentesque viverra pede ac diam. Cras pellentesque volutpat dui. Maecenas tristique, est et tempus semper, est quam pharetra magna, ac consequat metus sapien ut nunc. Vestibulum ante ipsum primis in faucibus orci luctus et ultrices posuere cubilia Curae; Mauris viverra diam vitae quam. Suspendisse potenti.",21-30,4.396666666666667,D
725,Bowie Skermer,59,bskermerk4@moonfruit.com,Czech Republic,intermediate,93.57,1,0.94,8.08,1.77,Suspendisse accumsan tortor quis turpis. Sed ante. Vivamus tortor.,51-60,3.5966666666666662,E
726,Pamelina Jerams,46,pjeramsk5@eventbrite.com,China,intermediate,17.06,1,1.46,6.78,4.65,"Duis bibendum. Morbi non quam nec dui luctus rutrum. Nulla tellus. In sagittis dui vel nisl. Duis ac nibh. Fusce lacus purus, aliquet at, feugiat non, pretium quis, lectus. Suspendisse potenti. In eleifend quam a odio. In hac habitasse platea dictumst.",41-50,4.296666666666667,D
727,Charity Kesey,46,ckeseyk6@deviantart.com,Argentina,advanced,37.16,1,9.92,1.4,3.29,"Nulla suscipit ligula in lacus. Curabitur at ipsum ac tellus semper interdum. Mauris ullamcorper purus sit amet nulla. Quisque arcu libero, rutrum ac, lobortis vel, dapibus at, diam. Nam tristique tortor eu pede.",41-50,4.87,D
728,Wye Zannolli,31,wzannollik7@cnn.com,Argentina,beginner,57.08,1,2.58,5.74,6.14,"Duis ac nibh. Fusce lacus purus, aliquet at, feugiat non, pretium quis, lectus. Suspendisse potenti. In eleifend quam a odio.",31-40,4.82,D
729,Amandie Tompsett,18,atompsettk8@yelp.com,Pakistan,advanced,7.06,1,8.65,7.56,3.74,"Pellentesque eget nunc. Donec quis orci eget orci vehicula condimentum. Curabitur in libero ut massa volutpat convallis. Morbi odio odio, elementum eu, interdum eu, tincidunt in, leo. Maecenas pulvinar lobortis est. Phasellus sit amet erat. Nulla tempus. Vivamus in felis eu sapien cursus vestibulum.",0-20,6.650000000000001,C
730,Catha Aumerle,52,caumerlek9@bandcamp.com,China,advanced,66.75,0,0.49,4.05,9.23,"Proin leo odio, porttitor id, consequat in, consequat ut, nulla. Sed accumsan felis. Ut at dolor quis odio consequat varius.",51-60,4.59,D
731,Emlyn McGorley,44,emcgorleyka@marriott.com,Ukraine,advanced,40.25,0,8.18,7.41,0.24,"In hac habitasse platea dictumst. Morbi vestibulum, velit id pretium iaculis, diam erat fermentum justo, nec condimentum neque sapien placerat ante. Nulla justo. Aliquam quis turpis eget elit sodales scelerisque. Mauris sit amet eros. Suspendisse accumsan tortor quis turpis. Sed ante.",41-50,5.276666666666666,D
732,Lesley Fiddler,60,lfiddlerkb@skyrock.com,Indonesia,beginner,81.53,1,5.78,8.61,1.37,"Ut at dolor quis odio consequat varius. Integer ac leo. Pellentesque ultrices mattis odio. Donec vitae nisi. Nam ultrices, libero non mattis pulvinar, nulla pede ullamcorper augue, a suscipit nulla elit ac nulla. Sed vel enim sit amet nunc viverra dapibus. Nulla suscipit ligula in lacus. Curabitur at ipsum ac tellus semper interdum.",51-60,5.253333333333334,D
733,Aggie Strutz,51,astrutzkc@wunderground.com,Peru,beginner,25.29,1,1.98,3.05,2.17,"Donec semper sapien a libero. Nam dui. Proin leo odio, porttitor id, consequat in, consequat ut, nulla. Sed accumsan felis. Ut at dolor quis odio consequat varius.",51-60,2.4,E
734,Kevin Walls,56,kwallskd@twitpic.com,France,advanced,22.18,0,9.49,4.36,3.49,"Vestibulum ante ipsum primis in faucibus orci luctus et ultrices posuere cubilia Curae; Duis faucibus accumsan odio. Curabitur convallis. Duis consequat dui nec nisi volutpat eleifend. Donec ut dolor. Morbi vel lectus in quam fringilla rhoncus. Mauris enim leo, rhoncus sed, vestibulum sit amet, cursus id, turpis. Integer aliquet, massa id lobortis convallis, tortor risus dapibus augue, vel accumsan tellus nisi eu orci. Mauris lacinia sapien quis libero. Nullam sit amet turpis elementum ligula vehicula consequat. Morbi a ipsum.",51-60,5.780000000000001,D
735,Brook Mossom,20,bmossomke@vistaprint.com,France,advanced,46.77,1,8.3,7.83,2.72,"In eleifend quam a odio. In hac habitasse platea dictumst. Maecenas ut massa quis augue luctus tincidunt. Nulla mollis molestie lorem. Quisque ut erat. Curabitur gravida nisi at nibh. In hac habitasse platea dictumst. Aliquam augue quam, sollicitudin vitae, consectetuer eget, rutrum at, lorem.",0-20,6.283333333333334,C
736,Ignace Gauche,52,igauchekf@arstechnica.com,Germany,intermediate,74.57,0,9.18,0.33,0.82,"Vestibulum ac est lacinia nisi venenatis tristique. Fusce congue, diam id ornare imperdiet, sapien urna pretium nisl, ut volutpat sapien arcu sed augue.",51-60,3.4433333333333334,E
737,Joann Bahls,41,jbahlskg@hatena.ne.jp,China,advanced,94.53,1,0.82,8.28,7.14,Nulla suscipit ligula in lacus.,41-50,5.413333333333333,D
738,Remus Daniely,20,rdanielykh@yahoo.co.jp,Russia,advanced,90.11,1,7.66,1.8,2.6,"Cum sociis natoque penatibus et magnis dis parturient montes, nascetur ridiculus mus. Etiam vel augue. Vestibulum rutrum rutrum neque. Aenean auctor gravida sem. Praesent id massa id nisl venenatis lacinia. Aenean sit amet justo.",0-20,4.0200000000000005,D
739,Wake Creany,43,wcreanyki@bandcamp.com,China,advanced,88.64,0,6.87,7.47,2.22,"Curabitur convallis. Duis consequat dui nec nisi volutpat eleifend. Donec ut dolor. Morbi vel lectus in quam fringilla rhoncus. Mauris enim leo, rhoncus sed, vestibulum sit amet, cursus id, turpis. Integer aliquet, massa id lobortis convallis, tortor risus dapibus augue, vel accumsan tellus nisi eu orci. Mauris lacinia sapien quis libero.",41-50,5.52,D
740,Fabien Neate,26,fneatekj@dot.gov,China,advanced,25.24,0,2.7,0.22,3.98,"Vestibulum ante ipsum primis in faucibus orci luctus et ultrices posuere cubilia Curae; Mauris viverra diam vitae quam. Suspendisse potenti. Nullam porttitor lacus at turpis. Donec posuere metus vitae ipsum. Aliquam non mauris. Morbi non lectus. Aliquam sit amet diam in magna bibendum imperdiet. Nullam orci pede, venenatis non, sodales sed, tincidunt eu, felis.",21-30,2.3000000000000003,E
741,Georgianna Harbertson,63,gharbertsonkk@toplist.cz,Indonesia,intermediate,78.78,0,8.44,7.36,2.75,"Vivamus metus arcu, adipiscing molestie, hendrerit at, vulputate vitae, nisl. Aenean lectus. Pellentesque eget nunc.",61-70,6.183333333333334,C
742,Dorey Blofeld,42,dblofeldkl@t.co,France,beginner,92.1,1,7.25,7.75,5.25,"Nulla tempus. Vivamus in felis eu sapien cursus vestibulum. Proin eu mi. Nulla ac enim. In tempor, turpis nec euismod scelerisque, quam turpis adipiscing lorem, vitae mattis nibh ligula nec sem. Duis aliquam convallis nunc. Proin at turpis a pede posuere nonummy.",41-50,6.75,C
743,Jeniece Darte,49,jdartekm@blogger.com,Nepal,intermediate,46.97,1,2.04,8.92,8.02,Suspendisse potenti.,41-50,6.326666666666667,C
744,Miguel Creamer,30,mcreamerkn@wired.com,Serbia,intermediate,73.81,0,7.49,0.15,5.8,"Proin leo odio, porttitor id, consequat in, consequat ut, nulla. Sed accumsan felis. Ut at dolor quis odio consequat varius. Integer ac leo. Pellentesque ultrices mattis odio. Donec vitae nisi. Nam ultrices, libero non mattis pulvinar, nulla pede ullamcorper augue, a suscipit nulla elit ac nulla. Sed vel enim sit amet nunc viverra dapibus.",21-30,4.48,D
745,Rena Bibbie,63,rbibbieko@nationalgeographic.com,Uzbekistan,intermediate,91.29,1,8.98,4.7,8.24,"Suspendisse potenti. In eleifend quam a odio. In hac habitasse platea dictumst. Maecenas ut massa quis augue luctus tincidunt. Nulla mollis molestie lorem. Quisque ut erat. Curabitur gravida nisi at nibh. In hac habitasse platea dictumst. Aliquam augue quam, sollicitudin vitae, consectetuer eget, rutrum at, lorem. Integer tincidunt ante vel ipsum.",61-70,7.3066666666666675,C
746,Maddie Lorkin,29,mlorkinkp@nhs.uk,United States,intermediate,30.64,0,6.07,7.84,2.79,"Praesent id massa id nisl venenatis lacinia. Aenean sit amet justo. Morbi ut odio. Cras mi pede, malesuada in, imperdiet et, commodo vulputate, justo.",21-30,5.566666666666666,D
747,Damiano Cockayme,51,dcockaymekq@goodreads.com,China,advanced,19.04,0,6.9,9.13,4.71,Donec posuere metus vitae ipsum.,51-60,6.913333333333334,C
748,Dulci Hartington,46,dhartingtonkr@delicious.com,China,advanced,82.37,1,3.29,0.72,2.57,Aliquam erat volutpat. In congue. Etiam justo. Etiam pretium iaculis justo. In hac habitasse platea dictumst. Etiam faucibus cursus urna. Ut tellus. Nulla ut erat id mauris vulputate elementum. Nullam varius. Nulla facilisi.,41-50,2.1933333333333334,E
749,Der Wichard,40,dwichardks@gmpg.org,Brazil,intermediate,3.2,1,4.66,9.99,9.14,"Integer pede justo, lacinia eget, tincidunt eget, tempus vel, pede. Morbi porttitor lorem id ligula. Suspendisse ornare consequat lectus. In est risus, auctor sed, tristique in, tempus sit amet, sem. Fusce consequat.",31-40,7.93,C
750,Otho Conre,27,oconrekt@artisteer.com,Finland,beginner,69.92,0,7.03,0.56,5.93,Integer tincidunt ante vel ipsum. Praesent blandit lacinia erat. Vestibulum sed magna at nunc commodo placerat. Praesent blandit.,21-30,4.506666666666667,D
751,Lodovico Scholefield,31,lscholefieldku@goodreads.com,North Korea,beginner,13.0,0,4.0,6.54,6.13,"In blandit ultrices enim. Lorem ipsum dolor sit amet, consectetuer adipiscing elit. Proin interdum mauris non ligula pellentesque ultrices. Phasellus id sapien in sapien iaculis congue. Vivamus metus arcu, adipiscing molestie, hendrerit at, vulputate vitae, nisl. Aenean lectus. Pellentesque eget nunc. Donec quis orci eget orci vehicula condimentum. Curabitur in libero ut massa volutpat convallis. Morbi odio odio, elementum eu, interdum eu, tincidunt in, leo.",31-40,5.556666666666666,D
752,Hans Brasener,40,hbrasenerkv@barnesandnoble.com,China,intermediate,23.45,1,6.01,5.19,1.17,In congue. Etiam justo. Etiam pretium iaculis justo. In hac habitasse platea dictumst. Etiam faucibus cursus urna. Ut tellus. Nulla ut erat id mauris vulputate elementum. Nullam varius. Nulla facilisi.,31-40,4.123333333333333,D
753,Liliane Leber,58,lleberkw@nyu.edu,Philippines,intermediate,80.12,1,2.21,5.31,6.49,Nulla ut erat id mauris vulputate elementum. Nullam varius. Nulla facilisi. Cras non velit nec nisi vulputate nonummy. Maecenas tincidunt lacus at velit. Vivamus vel nulla eget eros elementum pellentesque.,51-60,4.67,D
754,Barclay Enrietto,52,benriettokx@clickbank.net,Brazil,intermediate,96.36,0,9.26,7.83,4.67,"Suspendisse ornare consequat lectus. In est risus, auctor sed, tristique in, tempus sit amet, sem. Fusce consequat. Nulla nisl. Nunc nisl. Duis bibendum, felis sed interdum venenatis, turpis enim blandit mi, in porttitor pede justo eu massa. Donec dapibus. Duis at velit eu est congue elementum.",51-60,7.253333333333333,C
755,Symon Croster,58,scrosterky@google.ca,Philippines,advanced,74.04,1,7.37,0.91,4.2,"Donec dapibus. Duis at velit eu est congue elementum. In hac habitasse platea dictumst. Morbi vestibulum, velit id pretium iaculis, diam erat fermentum justo, nec condimentum neque sapien placerat ante. Nulla justo. Aliquam quis turpis eget elit sodales scelerisque.",51-60,4.16,D
756,Therine Vaines,31,tvaineskz@dell.com,China,advanced,9.63,1,4.54,1.21,2.62,"Nullam molestie nibh in lectus. Pellentesque at nulla. Suspendisse potenti. Cras in purus eu magna vulputate luctus. Cum sociis natoque penatibus et magnis dis parturient montes, nascetur ridiculus mus. Vivamus vestibulum sagittis sapien. Cum sociis natoque penatibus et magnis dis parturient montes, nascetur ridiculus mus. Etiam vel augue.",31-40,2.7900000000000005,E
757,Lolly Rosenauer,59,lrosenauerl0@mayoclinic.com,China,advanced,67.72,1,4.3,3.13,4.86,"Cum sociis natoque penatibus et magnis dis parturient montes, nascetur ridiculus mus. Etiam vel augue. Vestibulum rutrum rutrum neque. Aenean auctor gravida sem. Praesent id massa id nisl venenatis lacinia. Aenean sit amet justo. Morbi ut odio.",51-60,4.096666666666667,D
758,Langston Frye,50,lfryel1@tinypic.com,China,beginner,55.21,1,1.75,7.51,0.17,"In blandit ultrices enim. Lorem ipsum dolor sit amet, consectetuer adipiscing elit.",41-50,3.143333333333333,E
759,Huntley Iverson,26,hiversonl2@alexa.com,North Korea,intermediate,63.73,0,0.78,4.48,1.91,"Fusce congue, diam id ornare imperdiet, sapien urna pretium nisl, ut volutpat sapien arcu sed augue. Aliquam erat volutpat. In congue. Etiam justo. Etiam pretium iaculis justo. In hac habitasse platea dictumst. Etiam faucibus cursus urna. Ut tellus.",21-30,2.39,E
760,Grier Trimmill,52,gtrimmilll3@va.gov,Indonesia,intermediate,74.31,0,7.24,7.73,4.22,Vestibulum ante ipsum primis in faucibus orci luctus et ultrices posuere cubilia Curae; Mauris viverra diam vitae quam.,51-60,6.396666666666667,C
761,Ebenezer Ventham,57,eventhaml4@tamu.edu,Syria,intermediate,47.09,1,0.02,2.24,0.72,Duis bibendum. Morbi non quam nec dui luctus rutrum. Nulla tellus. In sagittis dui vel nisl. Duis ac nibh.,51-60,0.9933333333333335,F
762,Zaccaria Good,39,zgoodl5@techcrunch.com,Poland,advanced,7.49,0,2.1,9.95,7.37,"Nulla ut erat id mauris vulputate elementum. Nullam varius. Nulla facilisi. Cras non velit nec nisi vulputate nonummy. Maecenas tincidunt lacus at velit. Vivamus vel nulla eget eros elementum pellentesque. Quisque porta volutpat erat. Quisque erat eros, viverra eget, congue eget, semper rutrum, nulla. Nunc purus.",31-40,6.473333333333333,C
763,Ferd Chisnell,43,fchisnelll6@plala.or.jp,Sweden,beginner,16.6,0,2.39,0.67,0.88,"Morbi vel lectus in quam fringilla rhoncus. Mauris enim leo, rhoncus sed, vestibulum sit amet, cursus id, turpis.",41-50,1.3133333333333332,F
764,Felisha Marcinkowski,54,fmarcinkowskil7@ovh.net,Czech Republic,beginner,2.3,1,0.4,1.66,5.06,"Aenean auctor gravida sem. Praesent id massa id nisl venenatis lacinia. Aenean sit amet justo. Morbi ut odio. Cras mi pede, malesuada in, imperdiet et, commodo vulputate, justo. In blandit ultrices enim. Lorem ipsum dolor sit amet, consectetuer adipiscing elit.",51-60,2.373333333333333,E
765,Dieter Blackmuir,44,dblackmuirl8@nymag.com,Indonesia,beginner,98.48,1,5.66,6.41,3.99,"Aenean lectus. Pellentesque eget nunc. Donec quis orci eget orci vehicula condimentum. Curabitur in libero ut massa volutpat convallis. Morbi odio odio, elementum eu, interdum eu, tincidunt in, leo. Maecenas pulvinar lobortis est. Phasellus sit amet erat.",41-50,5.353333333333334,D
766,Natalie Mounsie,56,nmounsiel9@godaddy.com,Philippines,advanced,12.59,0,4.24,1.42,6.09,"Duis bibendum, felis sed interdum venenatis, turpis enim blandit mi, in porttitor pede justo eu massa. Donec dapibus. Duis at velit eu est congue elementum. In hac habitasse platea dictumst. Morbi vestibulum, velit id pretium iaculis, diam erat fermentum justo, nec condimentum neque sapien placerat ante. Nulla justo. Aliquam quis turpis eget elit sodales scelerisque.",51-60,3.9166666666666665,E
767,Eadmund Haughian,26,ehaughianla@cbslocal.com,China,advanced,68.53,0,7.76,2.6,7.73,"Duis bibendum. Morbi non quam nec dui luctus rutrum. Nulla tellus. In sagittis dui vel nisl. Duis ac nibh. Fusce lacus purus, aliquet at, feugiat non, pretium quis, lectus. Suspendisse potenti.",21-30,6.03,C
768,Bonny Baish,44,bbaishlb@businessweek.com,Brazil,beginner,32.77,1,8.51,0.07,3.97,Curabitur convallis. Duis consequat dui nec nisi volutpat eleifend. Donec ut dolor.,41-50,4.183333333333334,D
769,Perkin Bolger,64,pbolgerlc@123-reg.co.uk,China,advanced,90.19,0,7.6,8.82,5.24,"Maecenas tincidunt lacus at velit. Vivamus vel nulla eget eros elementum pellentesque. Quisque porta volutpat erat. Quisque erat eros, viverra eget, congue eget, semper rutrum, nulla. Nunc purus. Phasellus in felis. Donec semper sapien a libero. Nam dui. Proin leo odio, porttitor id, consequat in, consequat ut, nulla. Sed accumsan felis.",61-70,7.2200000000000015,C
770,Yorker Geeritz,59,ygeeritzld@blogs.com,Ireland,advanced,37.15,1,5.03,8.95,1.11,"Praesent lectus. Vestibulum quam sapien, varius ut, blandit non, interdum in, ante. Vestibulum ante ipsum primis in faucibus orci luctus et ultrices posuere cubilia Curae; Duis faucibus accumsan odio. Curabitur convallis. Duis consequat dui nec nisi volutpat eleifend. Donec ut dolor. Morbi vel lectus in quam fringilla rhoncus. Mauris enim leo, rhoncus sed, vestibulum sit amet, cursus id, turpis.",51-60,5.03,D
771,Clary McAvey,48,cmcaveyle@about.com,China,intermediate,4.12,1,7.37,2.65,7.55,Donec quis orci eget orci vehicula condimentum. Curabitur in libero ut massa volutpat convallis.,41-50,5.8566666666666665,D
772,Berty Hamsher,62,bhamsherlf@chicagotribune.com,Russia,advanced,60.8,1,9.28,9.31,2.69,"Nam congue, risus semper porta volutpat, quam pede lobortis ligula, sit amet eleifend pede libero quis orci. Nullam molestie nibh in lectus. Pellentesque at nulla. Suspendisse potenti. Cras in purus eu magna vulputate luctus. Cum sociis natoque penatibus et magnis dis parturient montes, nascetur ridiculus mus. Vivamus vestibulum sagittis sapien. Cum sociis natoque penatibus et magnis dis parturient montes, nascetur ridiculus mus. Etiam vel augue. Vestibulum rutrum rutrum neque.",61-70,7.093333333333334,C
773,Alleen Branchet,47,abranchetlg@sina.com.cn,Nicaragua,advanced,80.92,0,5.36,4.46,9.78,"Mauris sit amet eros. Suspendisse accumsan tortor quis turpis. Sed ante. Vivamus tortor. Duis mattis egestas metus. Aenean fermentum. Donec ut mauris eget massa tempor convallis. Nulla neque libero, convallis eget, eleifend luctus, ultricies eu, nibh. Quisque id justo sit amet sapien dignissim vestibulum.",41-50,6.533333333333334,C
774,Noam Penwarden,56,npenwardenlh@feedburner.com,China,advanced,96.32,0,7.69,5.26,5.75,"Nam dui. Proin leo odio, porttitor id, consequat in, consequat ut, nulla. Sed accumsan felis. Ut at dolor quis odio consequat varius. Integer ac leo. Pellentesque ultrices mattis odio. Donec vitae nisi. Nam ultrices, libero non mattis pulvinar, nulla pede ullamcorper augue, a suscipit nulla elit ac nulla. Sed vel enim sit amet nunc viverra dapibus.",51-60,6.233333333333333,C
775,Charlene Learie,57,clearieli@ask.com,Poland,intermediate,91.33,0,0.98,5.36,2.15,"Curabitur gravida nisi at nibh. In hac habitasse platea dictumst. Aliquam augue quam, sollicitudin vitae, consectetuer eget, rutrum at, lorem.",51-60,2.83,E
776,Moe Beurich,33,mbeurichlj@bloglovin.com,Mexico,intermediate,58.52,1,3.54,7.79,7.91,"Quisque id justo sit amet sapien dignissim vestibulum. Vestibulum ante ipsum primis in faucibus orci luctus et ultrices posuere cubilia Curae; Nulla dapibus dolor vel est. Donec odio justo, sollicitudin ut, suscipit a, feugiat et, eros. Vestibulum ac est lacinia nisi venenatis tristique. Fusce congue, diam id ornare imperdiet, sapien urna pretium nisl, ut volutpat sapien arcu sed augue. Aliquam erat volutpat.",31-40,6.413333333333334,C
777,Iolanthe Salle,31,isallelk@wisc.edu,Iran,intermediate,31.86,1,3.55,5.13,9.88,"Suspendisse ornare consequat lectus. In est risus, auctor sed, tristique in, tempus sit amet, sem. Fusce consequat. Nulla nisl. Nunc nisl. Duis bibendum, felis sed interdum venenatis, turpis enim blandit mi, in porttitor pede justo eu massa. Donec dapibus.",31-40,6.186666666666667,C
778,Tova Kornyakov,49,tkornyakovll@google.fr,Mexico,intermediate,51.36,0,6.07,5.67,7.24,"Maecenas rhoncus aliquam lacus. Morbi quis tortor id nulla ultrices aliquet. Maecenas leo odio, condimentum id, luctus nec, molestie sed, justo.",41-50,6.326666666666667,C
