student_id,student_name,age,email,country,language_level,attendance_rate,homework_completion,test1_score,test2_score,test3_score,teacher_feedback,age_range,final_grade,classification
237,Dieter Braunes,21,dbraunes6k@ow.ly,China,beginner,66.89,1,3.79,3.1,1.43,"Nulla facilisi. Cras non velit nec nisi vulputate nonummy. Maecenas tincidunt lacus at velit. Vivamus vel nulla eget eros elementum pellentesque. Quisque porta volutpat erat. Quisque erat eros, viverra eget, congue eget, semper rutrum, nulla. Nunc purus. Phasellus in felis. Donec semper sapien a libero. Nam dui.",21-30,2.7733333333333334,E
238,Hercules Nehls,54,hnehls6l@go.com,Sweden,beginner,29.52,0,5.41,9.17,7.68,Praesent blandit.,51-60,7.419999999999999,C
239,Woodman Whitman,33,wwhitman6m@europa.eu,Latvia,beginner,12.72,1,0.13,2.46,9.0,Etiam justo. Etiam pretium iaculis justo. In hac habitasse platea dictumst. Etiam faucibus cursus urna.,31-40,3.8633333333333333,E
240,Zea Ozanne,34,zozanne6n@tripadvisor.com,Ukraine,advanced,56.72,0,9.75,2.21,5.96,"Proin interdum mauris non ligula pellentesque ultrices. Phasellus id sapien in sapien iaculis congue. Vivamus metus arcu, adipiscing molestie, hendrerit at, vulputate vitae, nisl. Aenean lectus. Pellentesque eget nunc.",31-40,5.973333333333334,D
241,Nevsa Peet,43,npeet6o@jugem.jp,Israel,intermediate,94.99,1,8.08,6.57,8.32,"Morbi vestibulum, velit id pretium iaculis, diam erat fermentum justo, nec condimentum neque sapien placerat ante. Nulla justo. Aliquam quis turpis eget elit sodales scelerisque. Mauris sit amet eros. Suspendisse accumsan tortor quis turpis. Sed ante. Vivamus tortor.",41-50,7.656666666666666,C
242,Prince Culshew,55,pculshew6p@shareasale.com,Brazil,beginner,86.77,0,7.26,7.9,2.41,"Vestibulum quam sapien, varius ut, blandit non, interdum in, ante. Vestibulum ante ipsum primis in faucibus orci luctus et ultrices posuere cubilia Curae; Duis faucibus accumsan odio. Curabitur convallis.",51-60,5.8566666666666665,D
243,Odetta Steger,44,osteger6q@yandex.ru,Azerbaijan,beginner,24.75,0,9.99,7.75,3.52,"Cum sociis natoque penatibus et magnis dis parturient montes, nascetur ridiculus mus. Vivamus vestibulum sagittis sapien. Cum sociis natoque penatibus et magnis dis parturient montes, nascetur ridiculus mus. Etiam vel augue. Vestibulum rutrum rutrum neque.",41-50,7.086666666666667,C
244,Nial Lochran,29,nlochran6r@last.fm,China,advanced,25.41,0,9.51,8.08,5.97,"Integer aliquet, massa id lobortis convallis, tortor risus dapibus augue, vel accumsan tellus nisi eu orci. Mauris lacinia sapien quis libero. Nullam sit amet turpis elementum ligula vehicula consequat. Morbi a ipsum. Integer a nibh. In quis justo.",21-30,7.853333333333333,C
245,Wolfie Shillam,55,wshillam6s@cloudflare.com,Russia,advanced,25.34,1,1.21,3.95,5.95,"Donec odio justo, sollicitudin ut, suscipit a, feugiat et, eros. Vestibulum ac est lacinia nisi venenatis tristique. Fusce congue, diam id ornare imperdiet, sapien urna pretium nisl, ut volutpat sapien arcu sed augue.",51-60,3.703333333333333,E
246,Amara Longfellow,46,alongfellow6t@hhs.gov,Norway,beginner,47.28,0,8.79,2.14,9.48,"In hac habitasse platea dictumst. Aliquam augue quam, sollicitudin vitae, consectetuer eget, rutrum at, lorem. Integer tincidunt ante vel ipsum. Praesent blandit lacinia erat. Vestibulum sed magna at nunc commodo placerat.",41-50,6.803333333333334,C
247,Jerome Berk,64,jberk6u@apple.com,France,advanced,93.25,1,9.85,3.07,3.66,"Duis consequat dui nec nisi volutpat eleifend. Donec ut dolor. Morbi vel lectus in quam fringilla rhoncus. Mauris enim leo, rhoncus sed, vestibulum sit amet, cursus id, turpis.",61-70,5.526666666666666,D
248,Valenka Rickards,38,vrickards6v@jalbum.net,China,advanced,93.42,0,0.52,8.95,5.17,"Curabitur convallis. Duis consequat dui nec nisi volutpat eleifend. Donec ut dolor. Morbi vel lectus in quam fringilla rhoncus. Mauris enim leo, rhoncus sed, vestibulum sit amet, cursus id, turpis.",31-40,4.88,D
249,Saxe Woolsey,45,swoolsey6w@un.org,Egypt,advanced,15.08,0,9.29,1.86,4.55,"Nulla ac enim. In tempor, turpis nec euismod scelerisque, quam turpis adipiscing lorem, vitae mattis nibh ligula nec sem. Duis aliquam convallis nunc. Proin at turpis a pede posuere nonummy. Integer non velit. Donec diam neque, vestibulum eget, vulputate ut, ultrices vel, augue. Vestibulum ante ipsum primis in faucibus orci luctus et ultrices posuere cubilia Curae; Donec pharetra, magna vestibulum aliquet ultrices, erat tortor sollicitudin mi, sit amet lobortis sapien sapien non mi.",41-50,5.233333333333333,D
250,Ernesta Berends,42,eberends6x@narod.ru,China,advanced,63.12,1,7.66,0.2,8.29,"Maecenas tincidunt lacus at velit. Vivamus vel nulla eget eros elementum pellentesque. Quisque porta volutpat erat. Quisque erat eros, viverra eget, congue eget, semper rutrum, nulla.",41-50,5.383333333333333,D
251,Lonny Cossell,36,lcossell6y@cdbaby.com,China,beginner,24.84,0,9.91,4.42,2.54,Etiam justo. Etiam pretium iaculis justo. In hac habitasse platea dictumst. Etiam faucibus cursus urna. Ut tellus. Nulla ut erat id mauris vulputate elementum. Nullam varius. Nulla facilisi. Cras non velit nec nisi vulputate nonummy.,31-40,5.623333333333334,D
252,Hyatt Biasetti,33,hbiasetti6z@netscape.com,Indonesia,advanced,97.27,1,1.94,6.68,7.37,"Phasellus id sapien in sapien iaculis congue. Vivamus metus arcu, adipiscing molestie, hendrerit at, vulputate vitae, nisl. Aenean lectus. Pellentesque eget nunc. Donec quis orci eget orci vehicula condimentum. Curabitur in libero ut massa volutpat convallis.",31-40,5.329999999999999,D
253,Zaria Ornils,43,zornils70@wunderground.com,China,advanced,89.2,0,1.1,3.54,5.47,"Nunc rhoncus dui vel sem. Sed sagittis. Nam congue, risus semper porta volutpat, quam pede lobortis ligula, sit amet eleifend pede libero quis orci. Nullam molestie nibh in lectus.",41-50,3.3699999999999997,E
254,Aubert Davison,62,adavison71@booking.com,Russia,advanced,17.03,0,0.76,0.14,7.38,Suspendisse ornare consequat lectus.,61-70,2.76,E
255,Nestor Zukerman,54,nzukerman72@skype.com,Guatemala,advanced,30.15,0,4.75,7.49,1.98,"Nunc nisl. Duis bibendum, felis sed interdum venenatis, turpis enim blandit mi, in porttitor pede justo eu massa. Donec dapibus. Duis at velit eu est congue elementum. In hac habitasse platea dictumst. Morbi vestibulum, velit id pretium iaculis, diam erat fermentum justo, nec condimentum neque sapien placerat ante. Nulla justo.",51-60,4.74,D
256,Raoul Palk,42,rpalk73@hexun.com,Poland,intermediate,32.4,1,9.55,8.61,6.73,Ut at dolor quis odio consequat varius.,41-50,8.296666666666667,B
257,Laurene Nuccii,32,lnuccii74@sohu.com,Bulgaria,advanced,69.54,1,0.38,2.06,2.7,"Maecenas tincidunt lacus at velit. Vivamus vel nulla eget eros elementum pellentesque. Quisque porta volutpat erat. Quisque erat eros, viverra eget, congue eget, semper rutrum, nulla. Nunc purus.",31-40,1.7133333333333336,F
258,Thorstein Tocher,29,ttocher75@trellian.com,Brazil,intermediate,67.52,0,0.72,8.69,6.12,"Donec ut dolor. Morbi vel lectus in quam fringilla rhoncus. Mauris enim leo, rhoncus sed, vestibulum sit amet, cursus id, turpis. Integer aliquet, massa id lobortis convallis, tortor risus dapibus augue, vel accumsan tellus nisi eu orci. Mauris lacinia sapien quis libero. Nullam sit amet turpis elementum ligula vehicula consequat. Morbi a ipsum.",21-30,5.176666666666667,D
259,Ruddie Canland,24,rcanland76@wikimedia.org,Peru,advanced,96.88,1,7.68,1.93,8.52,"Sed sagittis. Nam congue, risus semper porta volutpat, quam pede lobortis ligula, sit amet eleifend pede libero quis orci. Nullam molestie nibh in lectus. Pellentesque at nulla. Suspendisse potenti. Cras in purus eu magna vulputate luctus.",21-30,6.043333333333333,C
260,Delly Houtby,58,dhoutby77@mashable.com,Honduras,advanced,22.35,1,4.51,9.49,0.61,"Nunc rhoncus dui vel sem. Sed sagittis. Nam congue, risus semper porta volutpat, quam pede lobortis ligula, sit amet eleifend pede libero quis orci. Nullam molestie nibh in lectus. Pellentesque at nulla. Suspendisse potenti. Cras in purus eu magna vulputate luctus. Cum sociis natoque penatibus et magnis dis parturient montes, nascetur ridiculus mus.",51-60,4.87,D
261,Hastie Ridolfi,61,hridolfi78@alexa.com,Russia,beginner,79.48,0,6.83,1.98,8.86,"Aenean fermentum. Donec ut mauris eget massa tempor convallis. Nulla neque libero, convallis eget, eleifend luctus, ultricies eu, nibh. Quisque id justo sit amet sapien dignissim vestibulum. Vestibulum ante ipsum primis in faucibus orci luctus et ultrices posuere cubilia Curae; Nulla dapibus dolor vel est. Donec odio justo, sollicitudin ut, suscipit a, feugiat et, eros.",61-70,5.890000000000001,D
262,Audrey Canero,38,acanero79@studiopress.com,Brazil,beginner,41.7,0,6.51,1.63,8.14,Suspendisse potenti. In eleifend quam a odio. In hac habitasse platea dictumst. Maecenas ut massa quis augue luctus tincidunt. Nulla mollis molestie lorem. Quisque ut erat. Curabitur gravida nisi at nibh.,31-40,5.426666666666667,D
263,Maddi Bilston,52,mbilston7a@netscape.com,Indonesia,beginner,67.0,1,7.15,7.24,2.61,"Nulla justo. Aliquam quis turpis eget elit sodales scelerisque. Mauris sit amet eros. Suspendisse accumsan tortor quis turpis. Sed ante. Vivamus tortor. Duis mattis egestas metus. Aenean fermentum. Donec ut mauris eget massa tempor convallis. Nulla neque libero, convallis eget, eleifend luctus, ultricies eu, nibh.",51-60,5.666666666666667,D
264,Radcliffe Spradbery,29,rspradbery7b@e-recht24.de,China,advanced,41.76,1,2.32,6.62,8.08,"Donec dapibus. Duis at velit eu est congue elementum. In hac habitasse platea dictumst. Morbi vestibulum, velit id pretium iaculis, diam erat fermentum justo, nec condimentum neque sapien placerat ante. Nulla justo. Aliquam quis turpis eget elit sodales scelerisque. Mauris sit amet eros. Suspendisse accumsan tortor quis turpis.",21-30,5.673333333333333,D
265,Nathalia Treves,35,ntreves7c@cargocollective.com,China,advanced,57.8,1,3.13,0.42,2.05,"Vestibulum quam sapien, varius ut, blandit non, interdum in, ante. Vestibulum ante ipsum primis in faucibus orci luctus et ultrices posuere cubilia Curae; Duis faucibus accumsan odio. Curabitur convallis. Duis consequat dui nec nisi volutpat eleifend. Donec ut dolor. Morbi vel lectus in quam fringilla rhoncus.",31-40,1.8666666666666665,F
266,Georgine Ross,26,gross7d@google.pl,Russia,advanced,5.74,1,3.9,5.85,2.07,"In hac habitasse platea dictumst. Aliquam augue quam, sollicitudin vitae, consectetuer eget, rutrum at, lorem. Integer tincidunt ante vel ipsum. Praesent blandit lacinia erat.",21-30,3.94,E
267,Albie Jensen,48,ajensen7e@studiopress.com,United States,beginner,74.79,0,8.21,1.17,6.25,Morbi a ipsum. Integer a nibh. In quis justo.,41-50,5.21,D
268,Sylvia Baroc,64,sbaroc7f@biglobe.ne.jp,Greece,advanced,60.41,1,1.29,7.69,1.23,"Morbi non lectus. Aliquam sit amet diam in magna bibendum imperdiet. Nullam orci pede, venenatis non, sodales sed, tincidunt eu, felis. Fusce posuere felis sed lacus. Morbi sem mauris, laoreet ut, rhoncus aliquet, pulvinar sed, nisl. Nunc rhoncus dui vel sem. Sed sagittis. Nam congue, risus semper porta volutpat, quam pede lobortis ligula, sit amet eleifend pede libero quis orci. Nullam molestie nibh in lectus. Pellentesque at nulla.",61-70,3.4033333333333338,E
269,Geri Coston,42,gcoston7g@goodreads.com,Rwanda,advanced,13.95,0,5.91,0.67,9.12,Curabitur at ipsum ac tellus semper interdum. Mauris ullamcorper purus sit amet nulla.,41-50,5.233333333333333,D
270,Stevena Longson,59,slongson7h@edublogs.org,Thailand,intermediate,19.42,1,7.8,0.84,6.65,"In blandit ultrices enim. Lorem ipsum dolor sit amet, consectetuer adipiscing elit. Proin interdum mauris non ligula pellentesque ultrices. Phasellus id sapien in sapien iaculis congue. Vivamus metus arcu, adipiscing molestie, hendrerit at, vulputate vitae, nisl. Aenean lectus. Pellentesque eget nunc.",51-60,5.096666666666667,D
271,Artur Gilfether,29,agilfether7i@google.com.br,Russia,intermediate,65.06,0,4.88,8.64,4.72,"Morbi quis tortor id nulla ultrices aliquet. Maecenas leo odio, condimentum id, luctus nec, molestie sed, justo. Pellentesque viverra pede ac diam.",21-30,6.079999999999999,C
272,Hart Martinyuk,38,hmartinyuk7j@mozilla.com,Portugal,advanced,46.38,1,5.6,2.94,1.69,"Fusce posuere felis sed lacus. Morbi sem mauris, laoreet ut, rhoncus aliquet, pulvinar sed, nisl. Nunc rhoncus dui vel sem. Sed sagittis. Nam congue, risus semper porta volutpat, quam pede lobortis ligula, sit amet eleifend pede libero quis orci.",31-40,3.4099999999999997,E
273,Jonis Purchon,56,jpurchon7k@si.edu,Ukraine,beginner,58.0,1,9.94,7.13,6.8,"Morbi quis tortor id nulla ultrices aliquet. Maecenas leo odio, condimentum id, luctus nec, molestie sed, justo. Pellentesque viverra pede ac diam. Cras pellentesque volutpat dui. Maecenas tristique, est et tempus semper, est quam pharetra magna, ac consequat metus sapien ut nunc.",51-60,7.956666666666667,C
274,Ara Gier,50,agier7l@tripadvisor.com,Iran,beginner,87.85,1,5.34,3.92,3.5,Phasellus sit amet erat. Nulla tempus.,41-50,4.253333333333333,D
275,Cairistiona Woodfin,51,cwoodfin7m@facebook.com,Russia,advanced,67.8,0,6.17,2.97,7.24,"Donec odio justo, sollicitudin ut, suscipit a, feugiat et, eros.",51-60,5.460000000000001,D
276,Alexine Panter,51,apanter7n@blogtalkradio.com,Yemen,advanced,31.9,0,8.11,3.88,7.7,"Donec odio justo, sollicitudin ut, suscipit a, feugiat et, eros. Vestibulum ac est lacinia nisi venenatis tristique. Fusce congue, diam id ornare imperdiet, sapien urna pretium nisl, ut volutpat sapien arcu sed augue.",51-60,6.563333333333333,C
277,Penelope Keer,21,pkeer7o@zdnet.com,Portugal,beginner,69.95,1,3.64,5.81,2.61,"Phasellus id sapien in sapien iaculis congue. Vivamus metus arcu, adipiscing molestie, hendrerit at, vulputate vitae, nisl. Aenean lectus. Pellentesque eget nunc. Donec quis orci eget orci vehicula condimentum. Curabitur in libero ut massa volutpat convallis. Morbi odio odio, elementum eu, interdum eu, tincidunt in, leo. Maecenas pulvinar lobortis est.",21-30,4.02,D
278,Franz Slyde,25,fslyde7p@github.com,Poland,advanced,94.58,0,4.55,9.92,0.58,"Morbi porttitor lorem id ligula. Suspendisse ornare consequat lectus. In est risus, auctor sed, tristique in, tempus sit amet, sem. Fusce consequat. Nulla nisl.",21-30,5.016666666666667,D
279,Allard Duplan,38,aduplan7q@topsy.com,Vietnam,beginner,72.54,0,2.77,9.45,5.82,Suspendisse potenti. In eleifend quam a odio. In hac habitasse platea dictumst. Maecenas ut massa quis augue luctus tincidunt. Nulla mollis molestie lorem.,31-40,6.013333333333333,C
280,Dionysus Deftie,21,ddeftie7r@domainmarket.com,Brazil,intermediate,98.76,1,4.25,1.46,1.02,"Maecenas pulvinar lobortis est. Phasellus sit amet erat. Nulla tempus. Vivamus in felis eu sapien cursus vestibulum. Proin eu mi. Nulla ac enim. In tempor, turpis nec euismod scelerisque, quam turpis adipiscing lorem, vitae mattis nibh ligula nec sem.",21-30,2.2433333333333336,E
281,Josselyn Clapton,57,jclapton7s@icq.com,China,advanced,21.99,0,4.17,9.92,5.59,Ut tellus. Nulla ut erat id mauris vulputate elementum. Nullam varius. Nulla facilisi. Cras non velit nec nisi vulputate nonummy. Maecenas tincidunt lacus at velit.,51-60,6.56,C
282,Ed Rosenfield,26,erosenfield7t@nytimes.com,Kazakhstan,advanced,50.51,1,7.44,6.03,5.92,"Maecenas leo odio, condimentum id, luctus nec, molestie sed, justo. Pellentesque viverra pede ac diam. Cras pellentesque volutpat dui. Maecenas tristique, est et tempus semper, est quam pharetra magna, ac consequat metus sapien ut nunc. Vestibulum ante ipsum primis in faucibus orci luctus et ultrices posuere cubilia Curae; Mauris viverra diam vitae quam. Suspendisse potenti. Nullam porttitor lacus at turpis. Donec posuere metus vitae ipsum. Aliquam non mauris. Morbi non lectus.",21-30,6.463333333333334,C
283,Lou Katzmann,29,lkatzmann7u@loc.gov,Indonesia,advanced,87.01,0,9.96,3.53,1.98,"Lorem ipsum dolor sit amet, consectetuer adipiscing elit. Proin interdum mauris non ligula pellentesque ultrices. Phasellus id sapien in sapien iaculis congue. Vivamus metus arcu, adipiscing molestie, hendrerit at, vulputate vitae, nisl. Aenean lectus. Pellentesque eget nunc. Donec quis orci eget orci vehicula condimentum.",21-30,5.156666666666667,D
284,Elden Gosnall,47,egosnall7v@a8.net,Argentina,intermediate,65.09,1,7.95,8.91,6.42,"Mauris sit amet eros. Suspendisse accumsan tortor quis turpis. Sed ante. Vivamus tortor. Duis mattis egestas metus. Aenean fermentum. Donec ut mauris eget massa tempor convallis. Nulla neque libero, convallis eget, eleifend luctus, ultricies eu, nibh. Quisque id justo sit amet sapien dignissim vestibulum.",41-50,7.760000000000001,C
285,Phillipe Eddicott,47,peddicott7w@washingtonpost.com,Nigeria,intermediate,62.5,1,3.39,8.9,8.9,"In quis justo. Maecenas rhoncus aliquam lacus. Morbi quis tortor id nulla ultrices aliquet. Maecenas leo odio, condimentum id, luctus nec, molestie sed, justo.",41-50,7.0633333333333335,C
286,Dillon Vockings,52,dvockings7x@hugedomains.com,China,beginner,13.01,0,1.85,5.81,0.3,Aliquam quis turpis eget elit sodales scelerisque. Mauris sit amet eros.,51-60,2.6533333333333333,E
287,Floris Dackombe,28,fdackombe7y@sina.com.cn,China,beginner,83.67,1,4.99,1.0,2.99,"Nulla neque libero, convallis eget, eleifend luctus, ultricies eu, nibh. Quisque id justo sit amet sapien dignissim vestibulum. Vestibulum ante ipsum primis in faucibus orci luctus et ultrices posuere cubilia Curae; Nulla dapibus dolor vel est. Donec odio justo, sollicitudin ut, suscipit a, feugiat et, eros. Vestibulum ac est lacinia nisi venenatis tristique.",21-30,2.9933333333333336,E
288,Karney Edworthie,25,kedworthie7z@ucsd.edu,Poland,beginner,34.09,1,6.43,3.64,1.74,Mauris lacinia sapien quis libero. Nullam sit amet turpis elementum ligula vehicula consequat. Morbi a ipsum. Integer a nibh. In quis justo.,21-30,3.936666666666667,E
289,Cynthie Abate,63,cabate80@ucla.edu,Haiti,beginner,25.6,1,0.38,3.72,3.14,"Morbi non quam nec dui luctus rutrum. Nulla tellus. In sagittis dui vel nisl. Duis ac nibh. Fusce lacus purus, aliquet at, feugiat non, pretium quis, lectus. Suspendisse potenti. In eleifend quam a odio. In hac habitasse platea dictumst. Maecenas ut massa quis augue luctus tincidunt.",61-70,2.4133333333333336,E
290,Sayers Bentham3,37,sbentham81@java.com,Palestinian Territory,advanced,15.64,1,6.67,6.19,5.18,"Quisque erat eros, viverra eget, congue eget, semper rutrum, nulla. Nunc purus. Phasellus in felis. Donec semper sapien a libero. Nam dui.",31-40,6.013333333333333,C
291,Charo McMillian,34,cmcmillian82@imgur.com,Indonesia,beginner,95.16,1,4.09,7.25,6.72,Curabitur convallis. Duis consequat dui nec nisi volutpat eleifend. Donec ut dolor. Morbi vel lectus in quam fringilla rhoncus.,31-40,6.02,C
292,Minetta Portt,37,mportt83@printfriendly.com,Colombia,beginner,36.11,0,2.27,6.31,5.43,"Donec ut dolor. Morbi vel lectus in quam fringilla rhoncus. Mauris enim leo, rhoncus sed, vestibulum sit amet, cursus id, turpis. Integer aliquet, massa id lobortis convallis, tortor risus dapibus augue, vel accumsan tellus nisi eu orci. Mauris lacinia sapien quis libero. Nullam sit amet turpis elementum ligula vehicula consequat. Morbi a ipsum.",31-40,4.67,D
293,Jessie Mutton,62,jmutton84@exblog.jp,Russia,intermediate,0.55,0,0.53,6.24,1.43,"Suspendisse potenti. In eleifend quam a odio. In hac habitasse platea dictumst. Maecenas ut massa quis augue luctus tincidunt. Nulla mollis molestie lorem. Quisque ut erat. Curabitur gravida nisi at nibh. In hac habitasse platea dictumst. Aliquam augue quam, sollicitudin vitae, consectetuer eget, rutrum at, lorem.",61-70,2.733333333333334,E
294,Darlleen Jeffree,21,djeffree85@newyorker.com,China,intermediate,91.06,1,7.15,8.24,4.75,"Nulla neque libero, convallis eget, eleifend luctus, ultricies eu, nibh. Quisque id justo sit amet sapien dignissim vestibulum. Vestibulum ante ipsum primis in faucibus orci luctus et ultrices posuere cubilia Curae; Nulla dapibus dolor vel est. Donec odio justo, sollicitudin ut, suscipit a, feugiat et, eros. Vestibulum ac est lacinia nisi venenatis tristique. Fusce congue, diam id ornare imperdiet, sapien urna pretium nisl, ut volutpat sapien arcu sed augue. Aliquam erat volutpat. In congue. Etiam justo.",21-30,6.713333333333334,C
295,Geoff Cisar,35,gcisar86@smh.com.au,Nigeria,advanced,14.14,1,9.91,9.17,0.12,"In est risus, auctor sed, tristique in, tempus sit amet, sem.",31-40,6.3999999999999995,C
296,Bendicty Crotty,51,bcrotty87@blinklist.com,France,intermediate,21.6,1,2.09,4.34,1.05,"Nulla tempus. Vivamus in felis eu sapien cursus vestibulum. Proin eu mi. Nulla ac enim. In tempor, turpis nec euismod scelerisque, quam turpis adipiscing lorem, vitae mattis nibh ligula nec sem. Duis aliquam convallis nunc.",51-60,2.493333333333333,E
297,Karilynn Cottle,52,kcottle88@berkeley.edu,United States,advanced,70.39,0,0.42,6.52,2.23,"Fusce consequat. Nulla nisl. Nunc nisl. Duis bibendum, felis sed interdum venenatis, turpis enim blandit mi, in porttitor pede justo eu massa. Donec dapibus. Duis at velit eu est congue elementum. In hac habitasse platea dictumst. Morbi vestibulum, velit id pretium iaculis, diam erat fermentum justo, nec condimentum neque sapien placerat ante.",51-60,3.0566666666666666,E
298,Georgette Wrankmore,26,gwrankmore89@hud.gov,China,advanced,98.91,0,5.81,5.14,2.78,In hac habitasse platea dictumst.,21-30,4.576666666666666,D
299,Anton Avrashin,34,aavrashin8a@jigsy.com,China,beginner,10.84,0,5.31,3.13,9.0,"Integer aliquet, massa id lobortis convallis, tortor risus dapibus augue, vel accumsan tellus nisi eu orci. Mauris lacinia sapien quis libero. Nullam sit amet turpis elementum ligula vehicula consequat.",31-40,5.813333333333333,D
300,Axe Cockson,41,acockson8b@1688.com,Peru,beginner,15.88,0,3.42,0.56,5.33,"Vivamus in felis eu sapien cursus vestibulum. Proin eu mi. Nulla ac enim. In tempor, turpis nec euismod scelerisque, quam turpis adipiscing lorem, vitae mattis nibh ligula nec sem. Duis aliquam convallis nunc. Proin at turpis a pede posuere nonummy. Integer non velit. Donec diam neque, vestibulum eget, vulputate ut, ultrices vel, augue.",41-50,3.1033333333333335,E
301,Maxine Kemster,30,mkemster8c@list-manage.com,China,beginner,81.43,0,8.61,6.4,4.64,"Maecenas rhoncus aliquam lacus. Morbi quis tortor id nulla ultrices aliquet. Maecenas leo odio, condimentum id, luctus nec, molestie sed, justo. Pellentesque viverra pede ac diam.",21-30,6.55,C
302,Lyndsay Verzey,33,lverzey8d@goo.gl,Serbia,beginner,44.78,0,5.21,7.14,1.8,Suspendisse potenti. Nullam porttitor lacus at turpis. Donec posuere metus vitae ipsum. Aliquam non mauris. Morbi non lectus. Aliquam sit amet diam in magna bibendum imperdiet.,31-40,4.716666666666667,D
303,Lammond De Miranda,58,lde8e@studiopress.com,Portugal,beginner,14.5,1,3.02,9.29,1.31,"Maecenas leo odio, condimentum id, luctus nec, molestie sed, justo. Pellentesque viverra pede ac diam. Cras pellentesque volutpat dui.",51-60,4.54,D
304,Laurie Storek,45,lstorek8f@google.ru,Indonesia,beginner,55.61,1,8.76,8.08,9.02,"Integer pede justo, lacinia eget, tincidunt eget, tempus vel, pede. Morbi porttitor lorem id ligula. Suspendisse ornare consequat lectus. In est risus, auctor sed, tristique in, tempus sit amet, sem. Fusce consequat.",41-50,8.62,B
305,Lilias Huckabe,48,lhuckabe8g@google.ca,Colombia,advanced,2.78,1,7.18,5.91,5.57,Etiam justo. Etiam pretium iaculis justo. In hac habitasse platea dictumst. Etiam faucibus cursus urna. Ut tellus. Nulla ut erat id mauris vulputate elementum. Nullam varius. Nulla facilisi.,41-50,6.22,C
306,Findley McKilroe,33,fmckilroe8h@mysql.com,New Zealand,advanced,80.15,1,3.51,8.33,7.85,"Curabitur in libero ut massa volutpat convallis. Morbi odio odio, elementum eu, interdum eu, tincidunt in, leo. Maecenas pulvinar lobortis est. Phasellus sit amet erat. Nulla tempus. Vivamus in felis eu sapien cursus vestibulum. Proin eu mi.",31-40,6.563333333333333,C
307,Allissa Freyne,49,afreyne8i@ycombinator.com,Moldova,beginner,82.93,1,0.72,0.44,8.76,In hac habitasse platea dictumst.,41-50,3.3066666666666666,E
308,Babb Ivashkov,53,bivashkov8j@clickbank.net,Uganda,beginner,79.17,1,6.0,8.63,9.29,"Fusce congue, diam id ornare imperdiet, sapien urna pretium nisl, ut volutpat sapien arcu sed augue. Aliquam erat volutpat. In congue. Etiam justo. Etiam pretium iaculis justo.",51-60,7.973333333333334,C
309,Willetta Telezhkin,39,wtelezhkin8k@discuz.net,China,beginner,46.27,0,3.58,7.17,3.84,"Praesent lectus. Vestibulum quam sapien, varius ut, blandit non, interdum in, ante. Vestibulum ante ipsum primis in faucibus orci luctus et ultrices posuere cubilia Curae; Duis faucibus accumsan odio. Curabitur convallis.",31-40,4.863333333333333,D
310,Jermaine Binnes,47,jbinnes8l@mashable.com,Indonesia,beginner,93.25,0,3.13,1.91,3.99,"Suspendisse potenti. In eleifend quam a odio. In hac habitasse platea dictumst. Maecenas ut massa quis augue luctus tincidunt. Nulla mollis molestie lorem. Quisque ut erat. Curabitur gravida nisi at nibh. In hac habitasse platea dictumst. Aliquam augue quam, sollicitudin vitae, consectetuer eget, rutrum at, lorem. Integer tincidunt ante vel ipsum.",41-50,3.0100000000000002,E
311,Paige Philipet,64,pphilipet8m@admin.ch,Philippines,intermediate,58.78,1,5.69,3.8,2.72,"Morbi odio odio, elementum eu, interdum eu, tincidunt in, leo. Maecenas pulvinar lobortis est.",61-70,4.07,D
312,Tristam Embery,57,tembery8n@ehow.com,Morocco,advanced,6.59,0,4.06,2.13,0.16,Duis aliquam convallis nunc. Proin at turpis a pede posuere nonummy. Integer non velit.,51-60,2.1166666666666667,E
313,Christabella Stansbie,42,cstansbie8o@woothemes.com,Indonesia,intermediate,13.5,1,2.82,5.39,7.39,"In sagittis dui vel nisl. Duis ac nibh. Fusce lacus purus, aliquet at, feugiat non, pretium quis, lectus. Suspendisse potenti. In eleifend quam a odio.",41-50,5.199999999999999,D
314,Arlen Lorenzetto,51,alorenzetto8p@dmoz.org,Brazil,advanced,26.18,0,2.82,9.69,4.5,"In blandit ultrices enim. Lorem ipsum dolor sit amet, consectetuer adipiscing elit.",51-60,5.669999999999999,D
